term,category,definition,usage_note,status,url,source,prov_class,examples,resource_id
Tool,Workflows,Physical or digital resource that helps an agent perform an action,,Approved,http://w3id.org/nfdi4ing/metadata4ing#Tool,Metadata4Ing: An ontology for describing the generation of research data within a scientific activity.,prov:Entity,,tool
Transaction,Workflows,"A cooperative interaction between two agents, involving the exchange or transfer of exchangeable products, services, rights, or funds or the processing of some request by one entity on behalf of the other",,Approved,,"Adopted from ISO/IEC TR 15067-3-8:2020 and ISO 6707-2:2017(en), 3.2.53",prov:Activity,,transaction
Transaction Identifier,Workflows,A global or local identifiers for a specific transaction,,Approved,,This Document,prov:Entity,,transaction-identifier
Trigger,Workflows,A specific event in a planned process that initializes a new workflow branch,Newly created workflows initiated by a formalized trigger are referred to as branches. ,Approved,,This Document,prov:Activity,,trigger
Uniform Resource Identifier,Identifiers,A Uniform Resource Identifier (URI) is a compact sequence of characters that identifies an abstract or physical resource. Notation: URI,,,https://datatracker.ietf.org/doc/html/rfc3986,,prov:Entity,http://rs.tdwg.org/dwc/terms/GeologicalContext,uri
Universal Resource Name,Identifiers,A URI that identifies a resource by name in a particular namespace. URNs provide globally-unique names for resources as opposed to providing information about their location (URL). Notation: URN,,,https://www.rfc-editor.org/rfc/rfc8141,,prov:Entity,urn:issn:1476-4687,urn
Universally Unique Identifier (Version 4),Identifiers,"Most commonly used universal identifier for machine-readable resources Notations: UUID, GUID",,,https://www.rfc-editor.org/rfc/rfc9562,https://www.rfc-editor.org/rfc/rfc9562,prov:Entity,405ebddc-7bec-42f7-97fc-10dbf14004e5,uuid
Validation,Data,A planned process with objective to check that the accuracy or the quality of a claim or prediction satisfies some criteria and which is assessed by comparing with independent results,,Approved,http://purl.obolibrary.org/obo/OBI_0302911,Ontology for Biomedical Investigations,prov:Activity,,validation
Value,Data,An articulation that is by social convention understood to be potentially assignable to a variable,,Approved,http://www.molmod.info/semantics/pims-ii.ttl#Value,Physicalistic Interpretation of Modelling and Simulation - Interoperability Infrastructure,prov:Entity,,value
Voucher specimen,Collections,A specimen that physically and permanently documents data in  published literature by verifying the identity of the organism(s) used in the  study and by doing so ensures that a study which otherwise could not be  repeated can be accurately reviewed or reassessed. ,Rock and  mineral specimens may serve as vouchers to document the geology of an area.,Approved,,Master Glossary for DOI Museum Property Directives,prov:Entity,,voucher-specimen
Workflow,Workflows,"A recorded sequence of connected steps, which may be automated, specifying a reliably repeatable sequence of operations to be undertaken during the lifecycle of data",A workflow is a type of prov:Activity that has at least two procedures as proper parts. A workflow may be seen as an abstract model of real work.,Approved,,"Adopted from EMMO, http://purl.org/spar/fabio/Workflow, http://purl.org/spar/pwo/Workflow",prov:Activity,,workflow
Workflow Action,Workflows,An Event with at least one participatory Agent that executes a Task that typically defined in a Plan as part of a Workflow,,Approved,http://www.ontologydesignpatterns.org/ont/dul/DUL.owl#Action,DOLCE+DnS Ultralite ontology,prov:Activity,,workflow-action
Workflow Branch,Workflows,A new instance of a workflow that splits from an existing workflow triggered by a planned activity such as acquiring a new collection object from an existing one (subsampling). The new workflow runs in parallel and is optionally reconnected for mobilization purposes.,,Approved,,This Document,prov:Entity,,workflow-branch
Workflow Event,Workflows,Something that happens during a process as part of a workflow and commonly affects the flow of the process.,"Here event is generalized to cover many things in a process, including the start or end of an Activity or a change in state of a specimen",Approved,,Adopted from https://www.irit.fr/recherches/MELODI/ontologies/BBO#Event,prov:Activity,,workflow-event
Workflow Management System,Workflows,"A system that defines, creates and manages the execution of workflows through the use of software, running on one or more workflow engines, which is able to interpret the process definition, interact with workflow participants and, where required, invoke the use of IT tools and applications.",,Approved,,Workflow Management Coalition Specification Document Number WFMC-TC-1011.,prov:Entity,,workflow-management-system
Workflow Phase,Workflows,"A distinguished part of a workflow comprised of a grouping of processes based on conceptual, thematic, functional and temporal criteria",Phases must be defined explicitly and unambiguously with minimal semantic overlap between phases belonging to the same workflow,Approved,,"This Document with contributions from ISO 24635-1:2025 and ISO/TS 16710-1:2024
",prov:Activity,,workflow-phase
Workflow Tool,Workflows,"Device, system or software used by an Agent to perform specific workflow tasks",,Approved,,Adopted from ISO/IEC 23000-15:2016,prov:Entity,,workflow-tool
